{
  "version": 1,
  "banks": {
    "AMEX": {
      "name": "Amex MR",
      "short": "Amex",
      "bg": "#E7EEF5",
      "fg": "#2E5B87"
    },
    "CHASE": {
      "name": "Chase UR",
      "short": "Chase",
      "bg": "#E5EBF4",
      "fg": "#16457F"
    },
    "CITI": {
      "name": "Citi ThankYou",
      "short": "Citi",
      "bg": "#E9EBF6",
      "fg": "#414FA0"
    },
    "C1": {
      "name": "Capital One",
      "short": "Cap One",
      "bg": "#F5E8E6",
      "fg": "#96393A"
    },
    "BILT": {
      "name": "Bilt Rewards",
      "short": "Bilt",
      "bg": "#ECEAE3",
      "fg": "#26221B"
    },
    "WF": {
      "name": "Wells Fargo",
      "short": "Wells",
      "bg": "#F5E7E3",
      "fg": "#872E2A"
    },
    "USB": {
      "name": "US Bank",
      "short": "US Bank",
      "bg": "#E4EAF6",
      "fg": "#153C8C"
    },
    "ESF": {
      "name": "Esfera",
      "short": "Esfera",
      "bg": "#F6E7E5",
      "fg": "#9E2C24"
    },
    "LIV": {
      "name": "Livelo",
      "short": "Livelo",
      "bg": "#F7E6EE",
      "fg": "#A81D5E"
    },
    "ROVE": {
      "name": "Rove Miles",
      "short": "Rove",
      "bg": "#E6F0EC",
      "fg": "#1F5C46"
    },
    "MAR": {
      "name": "Marriott Bonvoy",
      "short": "Marriott",
      "bg": "#F3E7E4",
      "fg": "#8C3B2E"
    },
    "WYN": {
      "name": "Wyndham Rewards",
      "short": "Wyndham",
      "bg": "#E5EAF3",
      "fg": "#1F4E79"
    },
    "CHO": {
      "name": "Choice Privileges",
      "short": "Choice",
      "bg": "#EAE7F2",
      "fg": "#4A3E86"
    }
  },
  "airlineDomains": {
    "AF": "airfrance.com",
    "AV": "lifemiles.com",
    "AM": "aeromexico.com",
    "VS": "virginatlantic.com",
    "QR": "qatarairways.com",
    "BA": "britishairways.com",
    "EI": "aerlingus.com",
    "CX": "cathaypacific.com",
    "NH": "ana.co.jp",
    "G3": "voegol.com.br",
    "LA": "latam.com",
    "AD": "voeazul.com.br",
    "BR": "evaair.com",
    "QF": "qantas.com",
    "JL": "jal.co.jp",
    "LH": "lufthansa.com",
    "AS": "alaskaair.com",
    "AA": "aa.com",
    "AC": "aircanada.com",
    "TK": "turkishairlines.com",
    "EK": "emirates.com",
    "SQ": "singaporeair.com",
    "UA": "united.com",
    "B6": "jetblue.com",
    "EY": "etihad.com",
    "IB": "iberia.com",
    "CM": "copaair.com",
    "TP": "flytap.com",
    "F9": "flyfrontier.com",
    "WN": "southwest.com",
    "AI": "airindia.com",
    "DL": "delta.com",
    "AY": "finnair.com",
    "HU": "hainanairlines.com",
    "9W": "intermiles.com",
    "MH": "malaysiaairlines.com",
    "SK": "flysas.com",
    "TG": "thaiairways.com",
    "VN": "vietnamairlines.com"
  },
  "airlineIconUrls": {
    "AD": "https://icons.duckduckgo.com/ip3/voeazul.com.br.ico",
    "BR": "https://icons.duckduckgo.com/ip3/www.evaair.com.ico",
    "JL": "https://icons.duckduckgo.com/ip3/www.jal.co.jp.ico"
  },
  "bankDomains": {
    "AMEX": "americanexpress.com",
    "CHASE": "chase.com",
    "CITI": "citi.com",
    "C1": "capitalone.com",
    "BILT": "biltrewards.com",
    "WF": "wellsfargo.com",
    "USB": "usbank.com",
    "ESF": "esfera.com.vc",
    "LIV": "livelo.com.br",
    "ROVE": "rovemiles.com",
    "MAR": "marriott.com",
    "WYN": "wyndhamhotels.com",
    "CHO": "choicehotels.com"
  },
  "airlineValues": {
    "AF": 1.3,
    "AV": 1.3,
    "AM": 0.8,
    "VS": 1.5,
    "QR": 1.4,
    "BA": 1.1,
    "EI": 1.4,
    "CX": 1.1,
    "NH": 1.4,
    "G3": 0.41,
    "LA": 0.57,
    "AD": 0.34,
    "BR": 1.3,
    "QF": 1.3,
    "JL": 1.3,
    "LH": 1.3,
    "AS": 1.5,
    "AA": 1.4,
    "AC": 1.4,
    "TK": 1.1,
    "EK": 1.2,
    "SQ": 1.3,
    "UA": 1.3,
    "B6": 1.3,
    "EY": 1.2,
    "IB": 1.4,
    "CM": 1.4,
    "TP": 1.1,
    "F9": 1,
    "WN": 1.3,
    "DL": 1.1,
    "AY": 1.4,
    "SK": 1.2,
    "VN": 1,
    "MH": 1,
    "TG": 1.1,
    "AI": 0.8
  },
  "airlineValueMeta": {
    "AF": {
      "currency": "USD",
      "asOf": "2026-10-27",
      "source": "https://frequentmiler.com/reasonable-redemption-values-rrvs/",
      "estimate": true,
      "note": "Editorial redemption estimate from Frequent Miler RRV, in US cents per mile; asOf records source verification."
    },
    "AV": {
      "currency": "USD",
      "asOf": "2026-10-27",
      "source": "https://frequentmiler.com/reasonable-redemption-values-rrvs/",
      "estimate": true,
      "note": "Editorial redemption estimate from Frequent Miler RRV, in US cents per mile; asOf records source verification."
    },
    "VS": {
      "currency": "USD",
      "asOf": "2026-10-27",
      "source": "https://frequentmiler.com/reasonable-redemption-values-rrvs/",
      "estimate": true,
      "note": "Editorial redemption estimate from Frequent Miler RRV, in US cents per mile; asOf records source verification."
    },
    "BA": {
      "currency": "USD",
      "asOf": "2026-10-27",
      "source": "https://frequentmiler.com/reasonable-redemption-values-rrvs/",
      "estimate": true,
      "note": "Editorial redemption estimate from Frequent Miler RRV, in US cents per mile; asOf records source verification."
    },
    "CX": {
      "currency": "USD",
      "asOf": "2026-10-27",
      "source": "https://frequentmiler.com/reasonable-redemption-values-rrvs/",
      "estimate": true,
      "note": "Editorial redemption estimate from Frequent Miler RRV, in US cents per mile; asOf records source verification."
    },
    "QF": {
      "currency": "USD",
      "asOf": "2026-10-27",
      "source": "https://frequentmiler.com/reasonable-redemption-values-rrvs/",
      "estimate": true,
      "note": "Editorial redemption estimate from Frequent Miler RRV, in US cents per mile; asOf records source verification."
    },
    "LH": {
      "currency": "USD",
      "asOf": "2026-10-27",
      "source": "https://frequentmiler.com/reasonable-redemption-values-rrvs/",
      "estimate": true,
      "note": "Editorial redemption estimate from Frequent Miler RRV, in US cents per mile; asOf records source verification."
    },
    "AS": {
      "currency": "USD",
      "asOf": "2026-10-27",
      "source": "https://frequentmiler.com/reasonable-redemption-values-rrvs/",
      "estimate": true,
      "note": "Editorial redemption estimate from Frequent Miler RRV, in US cents per mile; asOf records source verification."
    },
    "AA": {
      "currency": "USD",
      "asOf": "2026-10-27",
      "source": "https://frequentmiler.com/reasonable-redemption-values-rrvs/",
      "estimate": true,
      "note": "Editorial redemption estimate from Frequent Miler RRV, in US cents per mile; asOf records source verification."
    },
    "AC": {
      "currency": "USD",
      "asOf": "2026-10-27",
      "source": "https://frequentmiler.com/reasonable-redemption-values-rrvs/",
      "estimate": true,
      "note": "Editorial redemption estimate from Frequent Miler RRV, in US cents per mile; asOf records source verification."
    },
    "QR": {
      "currency": "USD",
      "asOf": "2026-10-27",
      "source": "https://thepointsguy.com/loyalty-programs/monthly-valuations/",
      "estimate": true,
      "note": "Editorial redemption estimate from The Points Guy, in US cents per mile; asOf records source verification. Uses the publisher's shared Avios estimate; British Airways retains its separate Frequent Miler estimate."
    },
    "EI": {
      "currency": "USD",
      "asOf": "2026-10-27",
      "source": "https://thepointsguy.com/loyalty-programs/monthly-valuations/",
      "estimate": true,
      "note": "Editorial redemption estimate from The Points Guy, in US cents per mile; asOf records source verification. Uses the publisher's shared Avios estimate; British Airways retains its separate Frequent Miler estimate."
    },
    "G3": {
      "currency": "BRL",
      "asOf": "2026-07-24",
      "source": "derived:operator-redemption-value",
      "note": "Smiles (GOL): R$0.02100 per point (R$21.00/1,000) — a REDEMPTION value, not an acquisition price. Converted at USD/BRL 5.074167 on 2026-07-24. Not covered by Frequent Miler RRV (US-market measure) nor TPG.",
      "sourceValue": 0.021,
      "sourceCurrency": "BRL",
      "fxRate": 5.074167
    },
    "LA": {
      "currency": "BRL",
      "asOf": "2026-07-24",
      "source": "derived:operator-redemption-value",
      "note": "LATAM Pass: R$0.02895 per point (R$28.95/1,000) — a REDEMPTION value, not an acquisition price. Converted at USD/BRL 5.074167 on 2026-07-24. Not covered by Frequent Miler RRV (US-market measure) nor TPG.",
      "sourceValue": 0.02895,
      "sourceCurrency": "BRL",
      "fxRate": 5.074167
    },
    "AD": {
      "currency": "BRL",
      "asOf": "2026-07-24",
      "source": "derived:operator-redemption-value",
      "note": "Azul Fidelidade: R$0.01750 per point (R$17.50/1,000) — a REDEMPTION value, not an acquisition price. Converted at USD/BRL 5.074167 on 2026-07-24. Not covered by Frequent Miler RRV (US-market measure) nor TPG.",
      "sourceValue": 0.0175,
      "sourceCurrency": "BRL",
      "fxRate": 5.074167
    },
    "AM": {
      "currency": "USD",
      "asOf": "2026-10-27",
      "source": "https://thepointsguy.com/loyalty-programs/monthly-valuations/",
      "estimate": true,
      "note": "Editorial redemption estimate from The Points Guy, in US cents per mile; asOf records source verification."
    },
    "NH": {
      "currency": "USD",
      "asOf": "2026-10-27",
      "source": "https://thepointsguy.com/loyalty-programs/monthly-valuations/",
      "estimate": true,
      "note": "Editorial redemption estimate from The Points Guy, in US cents per mile; asOf records source verification."
    },
    "BR": {
      "currency": "USD",
      "asOf": "2026-07-24",
      "source": "derived:peer-estimate",